=====================================UC 1 Create DataBase ===============================================

mysql> create database Address_Book_Service;
Query OK, 1 row affected (0.01 sec)

mysql> show databases;
+----------------------+
| Database             |
+----------------------+
| address_book_service |
| information_schema   |
| mysql                |
| payroll_service      |
| performance_schema   |
| sys                  |
+----------------------+
6 rows in set (0.01 sec)

mysql> use Address_Book_Service;
Database changed

================================================== UC 2 Create Table ==================================================

mysql> use address_book_service;
Database changed
mysql> create table Address_Book(
     firstname varchar(50) not null,
     lastname varchar(50) not null,
     address varchar(100) not null,
     city varchar(50) not null,
     state varchar(50) not null,
     zip int not null,
      phonenumber double not null,
     email varchar(100) not null);
Query OK, 0 rows affected (3.07 sec)

mysql> desc address_book;
+-------------+--------------+------+-----+---------+-------+
| Field       | Type         | Null | Key | Default | Extra |
+-------------+--------------+------+-----+---------+-------+
| firstname   | varchar(50)  | NO   |     | NULL    |       |
| lastname    | varchar(50)  | NO   |     | NULL    |       |
| address     | varchar(100) | NO   |     | NULL    |       |
| city        | varchar(50)  | NO   |     | NULL    |       |
| state       | varchar(50)  | NO   |     | NULL    |       |
| zip         | int          | NO   |     | NULL    |       |
| phonenumber | double       | NO   |     | NULL    |       |
| email       | varchar(100) | NO   |     | NULL    |       |
+-------------+--------------+------+-----+---------+-------+
8 rows in set (0.21 sec)

===================================================== UC 3 Insert Value In Table ========================================

mysql> insert into Address_Book(firstname,lastname,address,city,state,zip,phonenumber,email) values('Aniket','Kumbhar','kolhapur','kolhapur','maharashtra',500038,9177530369,'aniket@gmail.com');
Query OK, 1 row affected (0.01 sec)

mysql> insert into Address_Book(firstname,lastname,address,city,state,zip,phonenumber,email) values('Atul','Kumbhar','kolhapur','kagal','maharashtra',400038,8177530369,'atul@gmail.com');
Query OK, 1 row affected (0.01 sec)

mysql> insert into Address_Book(firstname,lastname,address,city,state,zip,phonenumber,email) values('Prashant','Mali','Nipani','Nipani','karnataka',400538,8477531234,'prashant@gmail.com');
Query OK, 1 row affected (0.01 sec)

mysql> insert into Address_Book(firstname,lastname,address,city,state,zip,phonenumber,email) values('Rohit','Bansod','Bhandra','Bhandara','maharashtra',555538,8967530369,'rohit@gmail.com');
Query OK, 1 row affected (0.00 sec)

mysql> select * from Address_book;
+-----------+----------+----------+----------+-------------+--------+-------------+--------------------+
| firstname | lastname | address  | city     | state       | zip    | phonenumber | email              |
+-----------+----------+----------+----------+-------------+--------+-------------+--------------------+
| Aniket    | Kumbhar  | kolhapur | kolhapur | maharashtra | 500038 |  9177530369 | aniket@gmail.com   |
| Atul      | Kumbhar  | kolhapur | kagal    | maharashtra | 400038 |  8177530369 | atul@gmail.com     |
| Prashant  | Mali     | Nipani   | Nipani   | karnataka   | 400538 |  8477531234 | prashant@gmail.com |
| Rohit     | Bansod   | Bhandra  | Bhandara | maharashtra | 555538 |  8967530369 | rohit@gmail.com    |
+-----------+----------+----------+----------+-------------+--------+-------------+--------------------+
4 rows in set (0.00 sec)

======================================= UC 4 Editing the existing contact by their firstname =========================================================

mysql> UPDATE Address_book SET firstname = 'Akshay' WHERE lastname = 'Bansod';
Query OK, 1 row affected (0.01 sec)
Rows matched: 1  Changed: 1  Warnings: 0

mysql> select * from Address_book;
+-----------+----------+----------+----------+-------------+--------+-------------+--------------------+
| firstname | lastname | address  | city     | state       | zip    | phonenumber | email              |
+-----------+----------+----------+----------+-------------+--------+-------------+--------------------+
| Aniket    | Kumbhar  | kolhapur | kolhapur | maharashtra | 500038 |  9177530369 | aniket@gmail.com   |
| Atul      | Kumbhar  | kolhapur | kagal    | maharashtra | 400038 |  8177530369 | atul@gmail.com     |
| Prashant  | Mali     | Nipani   | Nipani   | karnataka   | 400538 |  8477531234 | prashant@gmail.com |
| Akshay    | Bansod   | Bhandra  | Bhandara | maharashtra | 555538 |  8967530369 | rohit@gmail.com    |
+-----------+----------+----------+----------+-------------+--------+-------------+--------------------+
4 rows in set (0.00 sec)

============================================== UC 5 Deleting the contact by their lastname ============================================================================

mysql> DELETE FROM Address_book WHERE firstname='Akshay';
Query OK, 1 row affected (0.00 sec)

mysql> select * from Address_book;
+-----------+----------+----------+----------+-------------+--------+-------------+--------------------+
| firstname | lastname | address  | city     | state       | zip    | phonenumber | email              |
+-----------+----------+----------+----------+-------------+--------+-------------+--------------------+
| Aniket    | Kumbhar  | kolhapur | kolhapur | maharashtra | 500038 |  9177530369 | aniket@gmail.com   |
| Atul      | Kumbhar  | kolhapur | kagal    | maharashtra | 400038 |  8177530369 | atul@gmail.com     |
| Prashant  | Mali     | Nipani   | Nipani   | karnataka   | 400538 |  8477531234 | prashant@gmail.com |
+-----------+----------+----------+----------+-------------+--------+-------------+--------------------+
3 rows in set (0.00 sec)

=================================================== UC 6 Retrieving the contact by city or state ====================================================


mysql> select * from Address_book where city = 'kolhapur' or state = 'maharashtra';
+-----------+----------+----------+----------+-------------+--------+-------------+------------------+
| firstname | lastname | address  | city     | state       | zip    | phonenumber | email            |
+-----------+----------+----------+----------+-------------+--------+-------------+------------------+
| Aniket    | Kumbhar  | kolhapur | kolhapur | maharashtra | 500038 |  9177530369 | aniket@gmail.com |
| Atul      | Kumbhar  | kolhapur | kagal    | maharashtra | 400038 |  8177530369 | atul@gmail.com   |
+-----------+----------+----------+----------+-------------+--------+-------------+------------------+
2 rows in set (0.00 sec)

================================================== UC 7 Size of addressbook by city and state =======================================================

mysql> select count(firstname) from Address_book where city = 'kolhapur';
+------------------+
| count(firstname) |
+------------------+
|                1 |
+------------------+
1 row in set (0.00 sec)

==================================================== UC 8 Sorting the name alphbetically for given city =============================================

mysql> select firstname,city from Address_book order by city;
+-----------+----------+
| firstname | city     |
+-----------+----------+
| Atul      | kagal    |
| Aniket    | kolhapur |
| Prashant  | Nipani   |
+-----------+----------+
3 rows in set (0.00 sec)

================================================== UC 9 Altering the table with addressbook name and contact type ============================================================

mysql> alter table Address_book add bookname varchar(50) not null,add contacttype varchar(50) not null;
Query OK, 0 rows affected (0.06 sec)
Records: 0  Duplicates: 0  Warnings: 0

mysql> desc address_book;
+-------------+--------------+------+-----+---------+-------+
| Field       | Type         | Null | Key | Default | Extra |
+-------------+--------------+------+-----+---------+-------+
| firstname   | varchar(50)  | NO   |     | NULL    |       |
| lastname    | varchar(50)  | NO   |     | NULL    |       |
| address     | varchar(100) | NO   |     | NULL    |       |
| city        | varchar(50)  | NO   |     | NULL    |       |
| state       | varchar(50)  | NO   |     | NULL    |       |
| zip         | int          | NO   |     | NULL    |       |
| phonenumber | double       | NO   |     | NULL    |       |
| email       | varchar(100) | NO   |     | NULL    |       |
| bookname    | varchar(50)  | NO   |     | NULL    |       |
| contacttype | varchar(50)  | NO   |     | NULL    |       |
+-------------+--------------+------+-----+---------+-------+
10 rows in set (0.01 sec)

mysql> select * from address_book;
+-----------+----------+----------+----------+-------------+--------+-------------+--------------------+----------+-------------+
| firstname | lastname | address  | city     | state       | zip    | phonenumber | email              | bookname | contacttype |
+-----------+----------+----------+----------+-------------+--------+-------------+--------------------+----------+-------------+
| Aniket    | Kumbhar  | kolhapur | kolhapur | maharashtra | 500038 |  9177530369 | aniket@gmail.com   |          |             |
| Atul      | Kumbhar  | kolhapur | kagal    | maharashtra | 400038 |  8177530369 | atul@gmail.com     |          |             |
| Prashant  | Mali     | Nipani   | Nipani   | karnataka   | 400538 |  8477531234 | prashant@gmail.com | Student  | friend      |
+-----------+----------+----------+----------+-------------+--------+-------------+--------------------+----------+-------------+
3 rows in set (0.00 sec)

mysql> select * from Address_Book Where contacttype = 'friend';
+-----------+----------+---------+--------+-----------+--------+-------------+--------------------+----------+-------------+
| firstname | lastname | address | city   | state     | zip    | phonenumber | email              | bookname | contacttype |
+-----------+----------+---------+--------+-----------+--------+-------------+--------------------+----------+-------------+
| Prashant  | Mali     | Nipani  | Nipani | karnataka | 400538 |  8477531234 | prashant@gmail.com | Student  | friend      |
+-----------+----------+---------+--------+-----------+--------+-------------+--------------------+----------+-------------+
1 row in set (0.00 sec)


==================================================== UC 10 Ability to get count of contacts by contacttype ===============================================


mysql> select count(firstname) from Address_book where contacttype='friend';
+------------------+
| count(firstname) |
+------------------+
|                1 |
+------------------+
1 row in set (0.00 sec)

